{
  "id": "lesson-01-respiratory-anatomy",
  "moduleId": "module-01-fundamentals",
  "title": "Anatomía del Sistema Respiratorio",
  "description": "Esta lección aborda la anatomía detallada del sistema respiratorio desde las vías aéreas superiores hasta los alvéolos, con énfasis en su relevancia para la ventilación mecánica. Se cubren estructuras críticas para la intubación endotraqueal, diferencias anatómicas entre bronquios principales, y la organización del árbol bronquial hasta el nivel alveolar. El contenido es fundamental para comprender las complicaciones de la ventilación mecánica y aplicar estrategias protectoras.",
  "order": 1,
  "estimatedTime": 45,
  "difficulty": "beginner",
  "bloomLevel": "understand",
  "learningObjectives": [
    "Describir la anatomía de las vías aéreas superiores (nariz, cavidad oral, faringe, laringe) y su relevancia durante la intubación endotraqueal",
    "Identificar las estructuras clave de la laringe (epiglotis, cuerdas vocales, glotis) y explicar por qué constituyen la región más estrecha en la vía aérea adulta",
    "Reconocer las diferencias anatómicas entre el bronquio principal derecho e izquierdo y comprender cómo estas afectan la colocación del tubo endotraqueal y la ventilación de ambos pulmones",
    "Explicar la organización del árbol bronquial hasta los alvéolos y cómo la ventilación mecánica puede influir en cada nivel, especialmente la necesidad de PEEP para mantener alvéolos abiertos",
    "Aplicar el conocimiento anatómico para evitar y manejar complicaciones comunes de la ventilación mecánica como intubación selectiva de un pulmón, trauma en vías aéreas y barotrauma alveolar"
  ],
  "prerequisites": [],
  "sections": [
    {
      "id": "introduction",
      "order": 1,
      "type": "introduction",
      "title": "Introducción a la Anatomía Respiratoria en Ventilación Mecánica",
      "content": {
        "markdown": "## Importancia de la Anatomía en Ventilación Mecánica\n\nLa anatomía del sistema respiratorio tiene un papel fundamental en el manejo de la ventilación mecánica. Comprender la estructura de las vías respiratorias permite al profesional de la salud:\n\n- **Intubar de forma segura y eficaz**: Conocer las dimensiones y características anatómicas facilita la colocación correcta del tubo endotraqueal\n- **Ventilar sin causar lesiones**: El ventilador mecánico interactúa directamente con la vía aérea del paciente, desde la introducción de un tubo endotraqueal hasta la insuflación de aire en los pulmones\n- **Anticipar complicaciones**: Un sólido entendimiento anatómico ayuda a prevenir problemas como intubaciones difíciles, colocación incorrecta del tubo o barotrauma alveolar\n\nConocer las dimensiones y características anatómicas de la nariz, faringe, laringe, tráquea y bronquios es esencial para evitar trauma (por ejemplo, lesiones en cuerdas vocales o intubación de un solo pulmón) y para optimizar la oxigenación y ventilación.\n\n### Objetivos de Aprendizaje\n\nAl completar esta lección, serás capaz de:\n\n1. Describir la anatomía de las vías aéreas superiores y su relevancia durante la intubación\n2. Identificar las estructuras clave de la laringe y su importancia clínica\n3. Reconocer las diferencias anatómicas entre bronquios principales y sus implicaciones clínicas\n4. Explicar la organización del árbol bronquial hasta los alvéolos\n5. Aplicar el conocimiento anatómico para prevenir complicaciones de la ventilación mecánica"
      }
    },
    {
      "id": "upper-airways",
      "order": 2,
      "type": "theory",
      "title": "Vías Aéreas Superiores: Nariz, Cavidad Oral, Faringe y Laringe",
      "content": {
        "markdown": "## Anatomía de las Vías Aéreas Superiores\n\nLas vías respiratorias superiores actúan como la entrada y preparación del aire antes de que llegue a los pulmones. Esta región comprende estructuras críticas para la intubación endotraqueal.\n\n### Cavidad Nasal\n\nLa nariz filtra partículas, calienta y humedece el aire inspirado. Durante la ventilación mecánica con intubación, se bypassa esta función, por lo que el aire suministrado por el ventilador debe ser humidificado y calentado externamente para proteger la mucosa traqueobronquial.\n\n**Consideraciones anatómicas clave:**\n- Cornetes nasales: aumentan el área de superficie para calentamiento y humidificación\n- Mucosa nasal altamente vascularizada: proporciona calor al aire inspirado\n- Sistema de filtración mediante pelos nasales y moco\n\n### Faringe\n\nLa faringe, compartida con el tracto digestivo, conecta la cavidad nasal y oral con la laringe. Se divide en tres regiones:\n\n- **Nasofaringe**: Porción superior, detrás de la nariz\n- **Orofaringe**: Porción media, detrás de la boca\n- **Laringofaringe**: Porción inferior, que se continúa con la laringe\n\nDurante la intubación orotraqueal, el tubo pasa por la orofaringe hacia la laringe.\n\n### Laringe: Estructura Crítica para la Intubación\n\nLa laringe, sostenida por cartílagos (tiroides, cricoides, aritenoides), aloja las cuerdas vocales. La abertura entre las cuerdas vocales (**glotis**) es el segmento más estrecho de la vía aérea en el adulto, siendo el punto de paso obligado del tubo endotraqueal durante la intubación.\n\n#### Estructuras Clave de la Laringe:\n\n1. **Epiglotis**: Cartílago que actúa como una tapa protegiendo la vía aérea durante la deglución. Durante la laringoscopia, el clínico debe levantar la epiglotis para visualizar las cuerdas vocales.\n\n2. **Cuerdas Vocales**: Pliegues mucosos que forman la glotis. La visualización de las cuerdas vocales es esencial para una intubación exitosa.\n\n3. **Glotis**: El espacio entre las cuerdas vocales, punto más estrecho en adultos (~1 cm de diámetro en reposo).\n\n4. **Cartílago Cricoides**: Único cartílago laríngeo con forma de anillo completo, sirve como punto de referencia anatómico.\n\n#### Implicaciones Clínicas\n\n**Variaciones Anatómicas y Vía Aérea Difícil**:\n\nAspectos anatómicos como una lengua voluminosa, cuello corto o movilidad cervical limitada pueden hacer difícil la visualización de la glotis (vía aérea difícil). Por ello:\n\n- Conocer la anatomía permite posicionar adecuadamente al paciente (por ejemplo, en \"posición de olfateo\" que alinea los ejes oral, faríngeo y laríngeo)\n- Facilitar el uso de dispositivos adecuados (laringoscopios o videolaringoscopios) para una intubación exitosa\n- Reconocer factores predictores de intubación difícil (clasificación de Mallampati, distancia tiromentoniana, etc.)\n\n**Nota Pediátrica**: En niños pequeños, a diferencia de adultos, el punto más estrecho es la región subglótica a nivel del cartílago cricoides, lo que debe tenerse en cuenta al seleccionar el tamaño del tubo y en la técnica de intubación pediátrica.\n\n### Ejemplo Clínico\n\nUn paciente obeso con cuello corto llega a emergencias en insuficiencia respiratoria. Durante la intubación, el anestesiólogo encuentra dificultades para ver las cuerdas vocales (visión de Cormack-Lehane grado 3). Se aplican maniobras como la elevación del mentón y se utiliza un videolaringoscopio, logrando finalmente la intubación. Este caso ilustra cómo las variaciones anatómicas (obesidad, cuello corto) pueden complicar la intubación y cómo el conocimiento de la anatomía y las ayudas disponibles permiten asegurar la vía aérea de forma segura.",
        "media": {
          "images": [
            {
              "id": "upper-airway-diagram",
              "url": "https://placeholder.ventylab.com/images/upper-airway-diagram-sagittal.png",
              "alt": "Diagrama anatómico de las vías aéreas superiores mostrando cavidad nasal, boca, faringe, epiglotis, cuerdas vocales y tráquea",
              "caption": "Vista sagital de las vías aéreas superiores. Notar la posición de la epiglotis, cuerdas vocales y la continuidad hacia la tráquea. [[PENDING: Generar diagrama sagital de vías aéreas superiores mostrando cavidad nasal, boca, faringe, epiglotis, cuerdas vocales y tráquea con etiquetas anatómicas detalladas]]"
            },
            {
              "id": "laryngoscopic-view",
              "url": "https://placeholder.ventylab.com/images/laryngoscopic-view-interactive.png",
              "alt": "Vista desde la perspectiva de la laringoscopia mostrando epiglotis, cuerdas vocales y glotis",
              "caption": "Vista laringoscópica: imagen desde la perspectiva de la intubación. Identificar la epiglotis, las cuerdas vocales (glotis) y el espacio por donde debe pasar el tubo. [[PENDING: Generar vista laringoscópica interactiva mostrando epiglotis, cuerdas vocales y glotis desde la perspectiva de la intubación con clasificación de Cormack-Lehane]]"
            }
          ]
        }
      }
    },
    {
      "id": "trachea-bronchi",
      "order": 3,
      "type": "theory",
      "title": "Tráquea y Bronquios Principales",
      "content": {